{
  "version": "1.0.0",
  "venue": "binance",
  "symbol": "BTCUSDT",
  "timeframe": "4h",
  "zone_id": "zone-ob-btc-4h-001",
  "zone_type": "order_block",
  "direction": "demand",
  "upper_bound": 44000.0,
  "lower_bound": 43500.0,
  "created_time": "2024-01-14T08:00:00.000Z",
  "candle_count": 3,
  "strength": 0.85,
  "touches": 1,
  "is_active": true
}